============================= test session starts ==============================
platform darwin -- Python 3.10.14, pytest-8.4.1, pluggy-1.6.0 -- /opt/homebrew/opt/pyenv/versions/3.10.14/bin/python
cachedir: .pytest_cache
benchmark: 5.1.0 (defaults: timer=time.perf_counter disable_gc=False min_rounds=5 min_time=0.000005 max_time=1.0 calibration_precision=10 warmup=False warmup_iterations=100000)
rootdir: /Volumes/T7/athalia-dev-setup
configfile: pytest.ini
plugins: anyio-4.9.0, timeout-2.4.0, cov-4.1.0, benchmark-5.1.0, asyncio-1.0.0
asyncio: mode=strict, asyncio_default_fixture_loop_scope=None, asyncio_default_test_loop_scope=function
collecting ... collected 432 items

scripts/test_logging_activation.py::test_basic_logging PASSED            [  0%]
scripts/test_logging_activation.py::test_advanced_logging PASSED         [  0%]
scripts/test_logging_activation.py::test_log_file_creation PASSED        [  0%]
tests/bin/test_ath_audit.py::test_ath_audit_runs PASSED                  [  0%]
tests/bin/test_ath_build.py::test_ath_build_runs PASSED                  [  1%]
tests/bin/test_ath_coverage.py::test_ath_coverage_runs SKIPPED (Test...) [  1%]
tests/bin/test_ath_lint.py::test_ath_lint_runs PASSED                    [  1%]
tests/bin/test_ath_test.py::test_ath_test_runs SKIPPED (Test désacti...) [  1%]
tests/integration/test_cli_robustesse.py::test_cli_robustesse FAILED     [  2%]
tests/integration/test_end_to_end.py::test_generation_end_to_end SKIPPED [  2%]
tests/integration/test_yaml_validity.py::test_all_openapi_yaml_valid PASSED [  2%]
tests/test_adaptive_distillation.py::TestAdaptiveDistiller::test_empty PASSED [  2%]
tests/test_adaptive_distillation.py::TestAdaptiveDistiller::test_feedback_success_failure PASSED [  3%]
tests/test_adaptive_distillation.py::TestAdaptiveDistiller::test_majority_voting PASSED [  3%]
tests/test_adaptive_distillation.py::TestAdaptiveDistiller::test_save_and_load_history PASSED [  3%]
tests/test_adaptive_distillation.py::TestAdaptiveDistiller::test_update_preferences PASSED [  3%]
tests/test_advanced_analytics_unit.py::TestAdvancedAnalytics::test_analyze_coverage PASSED [  3%]
tests/test_advanced_analytics_unit.py::TestAdvancedAnalytics::test_analyze_performance PASSED [  4%]
tests/test_advanced_analytics_unit.py::TestAdvancedAnalytics::test_constructor PASSED [  4%]
tests/test_advanced_analytics_unit.py::TestAdvancedAnalytics::test_generate_dashboard PASSED [  4%]
tests/test_advanced_analytics_unit.py::TestAdvancedAnalytics::test_generate_summary PASSED [  4%]
tests/test_advanced_analytics_unit.py::TestAdvancedAnalytics::test_print_report PASSED [  5%]
tests/test_advanced_analytics_unit.py::TestAdvancedAnalytics::test_run PASSED [  5%]
tests/test_agent_network.py::TestAgentUnified::test_agent_imports PASSED [  5%]
tests/test_agent_network.py::TestAgentUnified::test_agent_unified_basic PASSED [  5%]
tests/test_ai_robust_standardized.py::TestAIRobust::test_build_fallback_chain PASSED [  6%]
tests/test_ai_robust_standardized.py::TestAIRobust::test_call_ollama_timeout PASSED [  6%]
tests/test_ai_robust_standardized.py::TestAIRobust::test_classify_project_complexity PASSED [  6%]
tests/test_ai_robust_standardized.py::TestAIRobust::test_detect_available_models PASSED [  6%]
tests/test_ai_robust_standardized.py::TestAIRobust::test_fallback_chain_behavior PASSED [  6%]
tests/test_ai_robust_standardized.py::TestAIRobust::test_generate_blueprint_with_mock PASSED [  7%]
tests/test_ai_robust_standardized.py::TestAIRobust::test_generate_documentation_with_mock PASSED [  7%]
tests/test_ai_robust_standardized.py::TestAIRobust::test_get_dynamic_prompt PASSED [  7%]
tests/test_ai_robust_standardized.py::TestAIRobust::test_review_code_with_mock PASSED [  7%]
tests/test_ai_robust_standardized.py::test_robust_ai_integration PASSED  [  8%]
tests/test_ai_robust_standardized.py::test_prompt_templates PASSED       [  8%]
tests/test_all_orchestrators.py::test_level_1_analyzer PASSED            [  8%]
tests/test_all_orchestrators.py::test_level_2_orchestrator PASSED        [  8%]
tests/test_all_orchestrators.py::test_level_3_coordinator PASSED         [  9%]
tests/test_all_orchestrators.py::test_integration PASSED                 [  9%]
tests/test_analytics.py::TestAnalyticsModule::test_analytics_module_import PASSED [  9%]
tests/test_analytics.py::TestAnalyticsModule::test_analyze_project SKIPPED [  9%]
tests/test_analytics.py::TestAnalyticsModule::test_generate_heatmap_data SKIPPED [  9%]
tests/test_analytics.py::TestAnalyticsModule::test_generate_technical_debt_analysis SKIPPED [ 10%]
tests/test_analytics.py::TestAnalyticsModule::test_generate_analytics_html SKIPPED [ 10%]
tests/test_analytics.py::TestAnalyticsModule::test_analytics_with_empty_project PASSED [ 10%]
tests/test_analytics.py::TestAnalyticsModule::test_analytics_with_nonexistent_project PASSED [ 10%]
tests/test_analytics.py::test_analytics_integration SKIPPED (Test d'...) [ 11%]
tests/test_athalia_simple.py::test_athalia_core_import PASSED            [ 11%]
tests/test_athalia_simple.py::test_essential_files_exist PASSED          [ 11%]
tests/test_athalia_simple.py::test_project_structure PASSED              [ 11%]
tests/test_audit_basic.py::TestAuditBasic::test_audit_project_basic SKIPPED [ 12%]
tests/test_audit_basic.py::TestAuditBasic::test_audit_nonexistent_project SKIPPED [ 12%]
tests/test_audit_basic.py::TestAuditBasic::test_audit_empty_project SKIPPED [ 12%]
tests/test_audit_basic.py::TestAuditBasic::test_project_structure_validation PASSED [ 12%]
tests/test_audit_basic.py::TestAuditBasic::test_file_content_validation PASSED [ 12%]
tests/test_audit_basic.py::TestAuditBasic::test_audit_with_options SKIPPED [ 13%]
tests/test_audit_basic.py::test_audit_integration PASSED                 [ 13%]
tests/test_audit_intelligent.py::TestAuditIntelligent::test_audit_project_structure PASSED [ 13%]
tests/test_audit_intelligent.py::TestAuditIntelligent::test_audit_code_quality PASSED [ 13%]
tests/test_audit_intelligent.py::TestAuditIntelligent::test_audit_security PASSED [ 14%]
tests/test_audit_intelligent.py::TestAuditIntelligent::test_audit_performance PASSED [ 14%]
tests/test_audit_intelligent.py::TestAuditIntelligent::test_audit_complete PASSED [ 14%]
tests/test_audit_intelligent.py::TestAuditIntelligent::test_generate_audit_report PASSED [ 14%]
tests/test_audit_intelligent.py::TestAuditIntelligent::test_audit_project_not_found PASSED [ 15%]
tests/test_audit_intelligent.py::TestAuditIntelligent::test_audit_empty_project PASSED [ 15%]
tests/test_audit_intelligent.py::test_audit_integration PASSED           [ 15%]
tests/test_auto_cicd_unit.py::TestAutoCICD::test_constructor PASSED      [ 15%]
tests/test_auto_cicd_unit.py::TestAutoCICD::test_detect_languages PASSED [ 15%]
tests/test_auto_cicd_unit.py::TestAutoCICD::test_detect_project_type_nodejs PASSED [ 16%]
tests/test_auto_cicd_unit.py::TestAutoCICD::test_detect_project_type_python PASSED [ 16%]
tests/test_auto_cicd_unit.py::TestAutoCICD::test_extract_dependencies_python PASSED [ 16%]
tests/test_auto_cicd_unit.py::TestAutoCICD::test_find_entry_points PASSED [ 16%]
tests/test_auto_cicd_unit.py::TestAutoCICD::test_generate_deployment_config PASSED [ 17%]
tests/test_auto_cicd_unit.py::TestAutoCICD::test_generate_docker_config PASSED [ 17%]
tests/test_auto_cicd_unit.py::TestAutoCICD::test_generate_github_actions PASSED [ 17%]
tests/test_auto_cicd_unit.py::TestAutoCICD::test_get_created_files PASSED [ 17%]
tests/test_auto_cicd_unit.py::TestAutoCICD::test_has_documentation PASSED [ 18%]
tests/test_auto_cicd_unit.py::TestAutoCICD::test_has_tests PASSED        [ 18%]
tests/test_auto_cicd_unit.py::TestAutoCICD::test_setup_cicd PASSED       [ 18%]
tests/test_auto_cicd_unit.py::test_generate_github_ci_yaml PASSED        [ 18%]
tests/test_auto_cleaner.py::TestAutoCleaner::test_auto_cleaner_initialization PASSED [ 18%]
tests/test_auto_cleaner.py::TestAutoCleaner::test_auto_cleaner_scan_files SKIPPED [ 19%]
tests/test_auto_cleaner.py::TestAutoCleaner::test_auto_cleaner_clean_files SKIPPED [ 19%]
tests/test_auto_cleaner.py::TestAutoCleaner::test_auto_cleaner_dry_run SKIPPED [ 19%]
tests/test_auto_cleaner.py::TestAutoCleaner::test_auto_cleaner_process_management SKIPPED [ 19%]
tests/test_auto_cleaner.py::TestAutoCleaner::test_auto_cleaner_report SKIPPED [ 20%]
tests/test_auto_cleaner.py::TestAutoCleaner::test_auto_cleaner_full_cleanup SKIPPED [ 20%]
tests/test_auto_cleaner.py::test_auto_cleaner_integration PASSED         [ 20%]
tests/test_auto_correction_avancee.py::TestAutoCorrectionAdvanced::test_advanced_modules_structure PASSED [ 20%]
tests/test_auto_correction_avancee.py::TestAutoCorrectionAdvanced::test_import_auto_correction SKIPPED [ 21%]
tests/test_auto_correction_avancee.py::TestAutoCorrectionAdvanced::test_import_dashboard_unified PASSED [ 21%]
tests/test_auto_correction_avancee.py::TestAutoCorrectionAdvanced::test_import_user_profiles SKIPPED [ 21%]
tests/test_auto_documenter_unit.py::TestAutoDocumenter::test_constructor PASSED [ 21%]
tests/test_auto_documenter_unit.py::TestAutoDocumenter::test_document_project PASSED [ 21%]
tests/test_auto_documenter_unit.py::TestAutoDocumenter::test_generate_api_documentation PASSED [ 22%]
tests/test_auto_documenter_unit.py::TestAutoDocumenter::test_generate_readme PASSED [ 22%]
tests/test_auto_documenter_unit.py::TestAutoDocumenter::test_generate_setup_guide PASSED [ 22%]
tests/test_auto_documenter_unit.py::TestAutoDocumenter::test_generate_usage_guide PASSED [ 22%]
tests/test_auto_documenter_unit.py::TestAutoDocumenter::test_get_created_files PASSED [ 23%]
tests/test_auto_documenter_unit.py::TestAutoDocumenter::test_load_translations PASSED [ 23%]
tests/test_auto_tester_unit.py::TestAutoTester::test_analyze_modules PASSED [ 23%]
tests/test_auto_tester_unit.py::TestAutoTester::test_constructor PASSED  [ 23%]
tests/test_auto_tester_unit.py::TestAutoTester::test_generate_integration_tests PASSED [ 24%]
tests/test_auto_tester_unit.py::TestAutoTester::test_generate_performance_tests PASSED [ 24%]
tests/test_auto_tester_unit.py::TestAutoTester::test_generate_test_report PASSED [ 24%]
tests/test_auto_tester_unit.py::TestAutoTester::test_generate_tests PASSED [ 24%]
tests/test_auto_tester_unit.py::TestAutoTester::test_generate_unit_tests PASSED [ 25%]
tests/test_autocomplete_server.py::test_autocomplete_nominal PASSED      [ 25%]
tests/test_autocomplete_server.py::test_autocomplete_empty_prompt PASSED [ 25%]
tests/test_autocomplete_server.py::test_ollama_autocomplete_engine PASSED [ 25%]
tests/test_benchmark_critical.py::test_critical_function_benchmark[athalia_core.advanced_analytics-AdvancedAnalytics-True] PASSED [ 25%]
tests/test_benchmark_critical.py::test_critical_function_benchmark[athalia_core.athalia_orchestrator-AthaliaOrchestrator-False] FAILED [ 26%]
tests/test_benchmark_critical.py::test_critical_function_benchmark[athalia_core.auto_tester-AutoTester-False] PASSED [ 26%]
tests/test_benchmark_critical.py::test_global_coverage_threshold SKIPPED [ 26%]
tests/test_booster_ia_VioletTwistAI.py::test_prompts_presence PASSED     [ 26%]
tests/test_booster_ia_VioletTwistAI.py::test_ath_dev_boost SKIPPED (...) [ 27%]
tests/test_booster_ia_VioletTwistAI.py::test_ath_context_prompt SKIPPED  [ 27%]
tests/test_booster_ia_VioletTwistAI.py::test_alias_sh PASSED             [ 27%]
tests/test_ci_basic.py::TestCIBasic::test_generate_github_ci_yaml PASSED [ 27%]
tests/test_ci_basic.py::TestCIBasic::test_add_coverage_badge PASSED      [ 28%]
tests/test_ci_basic.py::TestCIBasic::test_project_structure_for_ci PASSED [ 28%]
tests/test_ci_basic.py::TestCIBasic::test_ci_with_nonexistent_project PASSED [ 28%]
tests/test_ci_basic.py::TestCIBasic::test_ci_with_empty_project PASSED   [ 28%]
tests/test_ci_basic.py::TestCIBasic::test_github_workflow_structure FAILED [ 28%]
tests/test_ci_basic.py::test_ci_integration PASSED                       [ 29%]
tests/test_cleanup.py::test_clean_old_tests_and_caches PASSED            [ 29%]
tests/test_cleanup.py::test_cleanup_module_import PASSED                 [ 29%]
tests/test_code_genetics.py::TestCodeGenetics::test_crossover PASSED     [ 29%]
tests/test_code_genetics.py::TestCodeGenetics::test_empty PASSED         [ 30%]
tests/test_code_genetics.py::TestCodeGenetics::test_evolve PASSED        [ 30%]
tests/test_code_genetics.py::TestCodeGenetics::test_mutate PASSED        [ 30%]
tests/test_code_genetics.py::TestCodeGenetics::test_select PASSED        [ 30%]
tests/test_complet_athalia_imports.py::test_imports_basic PASSED         [ 31%]
tests/test_complet_athalia_imports.py::test_imports_specific PASSED      [ 31%]
tests/test_complet_athalia_imports.py::test_imports_athalia_core PASSED  [ 31%]
tests/test_complet_athalia_syntax.py::test_syntax_python_basic PASSED    [ 31%]
tests/test_complet_athalia_syntax.py::test_syntax_python_specific_files PASSED [ 31%]
tests/test_config_manager.py::TestConfigManager::test_config_manager_initialization SKIPPED [ 32%]
tests/test_config_manager.py::TestConfigManager::test_load_config_from_file SKIPPED [ 32%]
tests/test_config_manager.py::TestConfigManager::test_save_config_to_file SKIPPED [ 32%]
tests/test_config_manager.py::TestConfigManager::test_config_manager_get_set SKIPPED [ 32%]
tests/test_config_manager.py::TestConfigManager::test_config_manager_validation SKIPPED [ 33%]
tests/test_config_manager.py::TestConfigManager::test_config_manager_merge SKIPPED [ 33%]
tests/test_config_manager.py::TestConfigManager::test_config_manager_environment_variables SKIPPED [ 33%]
tests/test_config_manager.py::test_config_integration SKIPPED (Modul...) [ 33%]
tests/test_continue_models.py::test_models_presence PASSED               [ 34%]
tests/test_correction.py::test_audit PASSED                              [ 34%]
tests/test_correction.py::test_correction PASSED                         [ 34%]
tests/test_correction.py::test_generation_improvement PASSED             [ 34%]
tests/test_correction_optimizer_optimized.py::TestCorrectionOptimizerOptimized::test_basic_corrections FAILED [ 34%]
tests/test_correction_optimizer_optimized.py::TestCorrectionOptimizerOptimized::test_complex_correction FAILED [ 35%]
tests/test_correction_optimizer_optimized.py::TestCorrectionOptimizerOptimized::test_contextual_corrections FAILED [ 35%]
tests/test_correction_optimizer_optimized.py::TestCorrectionOptimizerOptimized::test_convenience_functions FAILED [ 35%]
tests/test_correction_optimizer_optimized.py::TestCorrectionOptimizerOptimized::test_correction_stats PASSED [ 35%]
tests/test_correction_optimizer_optimized.py::TestCorrectionOptimizerOptimized::test_error_handling FAILED [ 36%]
tests/test_correction_optimizer_optimized.py::TestCorrectionOptimizerOptimized::test_learning_from_corrections PASSED [ 36%]
tests/test_correction_optimizer_optimized.py::TestCorrectionOptimizerOptimized::test_performance_logging PASSED [ 36%]
tests/test_correction_optimizer_optimized.py::TestCorrectionOptimizerIntegration::test_with_real_files FAILED [ 36%]
tests/test_corrections_validation.py::test_pytestignore_exists PASSED    [ 37%]
tests/test_corrections_validation.py::test_plugins_manager_exists PASSED [ 37%]
tests/test_corrections_validation.py::test_plugins_manager_functions PASSED [ 37%]
tests/test_corrections_validation.py::test_templates_exist PASSED        [ 37%]
tests/test_corrections_validation.py::test_base_templates_function PASSED [ 37%]
tests/test_corrections_validation.py::test_template_rendering PASSED     [ 38%]
tests/test_corrections_validation.py::test_documentation_exists PASSED   [ 38%]
tests/test_corrections_validation.py::test_audit_intelligent_import PASSED [ 38%]
tests/test_corrections_validation.py::test_audit_intelligent_instantiation PASSED [ 38%]
tests/test_coverage_threshold.py::TestCoverageThreshold::test_coverage_file_exists PASSED [ 39%]
tests/test_coverage_threshold.py::TestCoverageThreshold::test_minimum_coverage_threshold PASSED [ 39%]
tests/test_coverage_threshold.py::TestCoverageThreshold::test_core_modules_coverage PASSED [ 39%]
tests/test_coverage_threshold.py::TestCoverageThreshold::test_test_files_exist PASSED [ 39%]
tests/test_coverage_threshold.py::TestCoverageThreshold::test_test_coverage_structure PASSED [ 40%]
tests/test_coverage_threshold.py::TestCoverageThreshold::test_no_untested_critical_modules PASSED [ 40%]
tests/test_coverage_threshold.py::TestCoverageThreshold::test_coverage_report_readable PASSED [ 40%]
tests/test_coverage_threshold.py::TestCoverageThreshold::test_coverage_configuration SKIPPED [ 40%]
tests/test_coverage_threshold.py::TestCoverageThreshold::test_test_execution_coverage PASSED [ 40%]
tests/test_coverage_threshold.py::TestCoverageThreshold::test_coverage_quality_metrics PASSED [ 41%]
tests/test_data_cleanup.py::TestDataCleanup::test_data_cleaner_initialization SKIPPED [ 41%]
tests/test_data_cleanup.py::TestDataCleanup::test_find_analysis_files SKIPPED [ 41%]
tests/test_data_cleanup.py::TestDataCleanup::test_get_file_hash SKIPPED  [ 41%]
tests/test_data_cleanup.py::TestDataCleanup::test_categorize_files SKIPPED [ 42%]
tests/test_data_cleanup.py::TestDataCleanup::test_is_file_important SKIPPED [ 42%]
tests/test_data_cleanup.py::TestDataCleanup::test_archive_important_files SKIPPED [ 42%]
tests/test_data_cleanup.py::TestDataCleanup::test_remove_duplicates SKIPPED [ 42%]
tests/test_data_cleanup.py::TestDataCleanup::test_remove_old_files SKIPPED [ 43%]
tests/test_data_cleanup.py::TestDataCleanup::test_generate_report SKIPPED [ 43%]
tests/test_data_cleanup.py::TestDataCleanup::test_cleanup_dry_run SKIPPED [ 43%]
tests/test_data_cleanup.py::TestDataCleanup::test_cleanup_full SKIPPED   [ 43%]
tests/test_data_cleanup.py::test_data_cleaner_integration SKIPPED (M...) [ 43%]
tests/test_distillation_optimized.py::TestResponseDistillerOptimized::test_consensus PASSED [ 44%]
tests/test_distillation_optimized.py::TestResponseDistillerOptimized::test_consensus_divergents PASSED [ 44%]
tests/test_distillation_optimized.py::TestResponseDistillerOptimized::test_empty_responses PASSED [ 44%]
tests/test_distillation_optimized.py::TestResponseDistillerOptimized::test_majority_voting PASSED [ 44%]
tests/test_distillation_optimized.py::TestResponseDistillerOptimized::test_stacking PASSED [ 45%]
tests/test_distillation_optimized.py::TestAuditDistillerOptimized::test_empty_audits PASSED [ 45%]
tests/test_distillation_optimized.py::TestAuditDistillerOptimized::test_weighted_average PASSED [ 45%]
tests/test_distillation_optimized.py::TestCorrectionDistillerOptimized::test_best_score PASSED [ 45%]
tests/test_distillation_optimized.py::TestCorrectionDistillerOptimized::test_empty_corrections PASSED [ 46%]
tests/test_distillation_optimized.py::TestQualityScorerOptimized::test_score_default PASSED [ 46%]
tests/test_distillation_optimized.py::TestQualityScorerOptimized::test_score_various_inputs PASSED [ 46%]
tests/test_encoding_utf8.py::TestEncodingUTF8::test_python_files_utf8 PASSED [ 46%]
tests/test_encoding_utf8.py::TestEncodingUTF8::test_markdown_files_utf8 PASSED [ 46%]
tests/test_encoding_utf8.py::TestEncodingUTF8::test_yaml_files_utf8 PASSED [ 47%]
tests/test_encoding_utf8.py::TestEncodingUTF8::test_txt_files_utf8 PASSED [ 47%]
tests/test_encoding_utf8.py::TestEncodingUTF8::test_requirements_utf8 PASSED [ 47%]
tests/test_encoding_utf8.py::TestEncodingUTF8::test_config_utf8 PASSED   [ 47%]
tests/test_encoding_utf8.py::TestEncodingUTF8::test_no_bom_marker PASSED [ 48%]
tests/test_encoding_utf8.py::TestEncodingUTF8::test_consistent_line_endings PASSED [ 48%]
tests/test_final_validation.py::test_ast_analyzer PASSED                 [ 48%]
tests/test_final_validation.py::test_pattern_detector PASSED             [ 48%]
tests/test_final_validation.py::test_architecture_analyzer PASSED        [ 49%]
tests/test_final_validation.py::test_performance_analyzer PASSED         [ 49%]
tests/test_final_validation.py::test_intelligent_analyzer PASSED         [ 49%]
tests/test_generation.py::TestGenerationModule::test_generation_module_import PASSED [ 49%]
tests/test_generation.py::TestGenerationModule::test_project_generator_initialization SKIPPED [ 50%]
tests/test_generation.py::TestGenerationModule::test_generate_blueprint_mock PASSED [ 50%]
tests/test_generation.py::TestGenerationModule::test_save_blueprint SKIPPED [ 50%]
tests/test_generation.py::TestGenerationModule::test_scan_existing_project SKIPPED [ 50%]
tests/test_generation.py::TestGenerationModule::test_generate_project_structure SKIPPED [ 50%]
tests/test_generation.py::TestGenerationModule::test_generate_blueprint_ia SKIPPED [ 51%]
tests/test_generation.py::test_generation_integration PASSED             [ 51%]
tests/test_hardcoded_paths.py::TestHardcodedPaths::test_no_absolute_paths_in_source SKIPPED [ 51%]
tests/test_hardcoded_paths.py::TestHardcodedPaths::test_no_absolute_paths SKIPPED [ 51%]
tests/test_hardcoded_paths.py::TestHardcodedPaths::test_no_desktop_paths SKIPPED [ 52%]
tests/test_i18n.py::test_i18n_module_import SKIPPED (Module i18n non...) [ 52%]
tests/test_i18n.py::test_french_translations SKIPPED (Module fr non ...) [ 52%]
tests/test_i18n.py::test_english_translations SKIPPED (Module en non...) [ 52%]
tests/test_i18n.py::test_translation_consistency SKIPPED (Modules de...) [ 53%]
tests/test_imports_all.py::TestImportsAll::test_core_modules_import SKIPPED [ 53%]
tests/test_imports_all.py::TestImportsAll::test_distillation_modules_import PASSED [ 53%]
tests/test_imports_all.py::TestImportsAll::test_classification_modules_import PASSED [ 53%]
tests/test_imports_all.py::TestImportsAll::test_i18n_modules_import SKIPPED [ 53%]
tests/test_imports_all.py::TestImportsAll::test_plugins_modules_import SKIPPED [ 54%]
tests/test_imports_all.py::TestImportsAll::test_modules_import SKIPPED   [ 54%]
tests/test_imports_all.py::TestImportsAll::test_agents_import SKIPPED    [ 54%]
tests/test_imports_all.py::TestImportsAll::test_templates_import SKIPPED [ 54%]
tests/test_imports_all.py::TestImportsAll::test_all_python_files_importable SKIPPED [ 55%]
tests/test_imports_all.py::TestImportsAll::test_no_circular_imports PASSED [ 55%]
tests/test_imports_all.py::TestImportsAll::test_third_party_imports SKIPPED [ 55%]
tests/test_integration_autogen.py::TestIntegrationAutoGen::test_autogen_orchestration SKIPPED [ 55%]
tests/test_integration_orchestrator.py::TestOrchestratorIntegration::test_integrated_modules_imports PASSED [ 56%]
tests/test_integration_orchestrator.py::TestOrchestratorIntegration::test_integration_score SKIPPED [ 56%]
tests/test_integration_orchestrator.py::TestOrchestratorIntegration::test_module_functionality PASSED [ 56%]
tests/test_integration_orchestrator.py::TestOrchestratorIntegration::test_orchestrator_configuration PASSED [ 56%]
tests/test_integration_orchestrator.py::TestOrchestratorIntegration::test_orchestrator_imports PASSED [ 56%]
tests/test_integration_orchestrator.py::TestOrchestratorIntegration::test_orchestrator_initialization PASSED [ 57%]
tests/test_integration_orchestrator.py::TestOrchestratorIntegration::test_orchestrator_orchestration PASSED [ 57%]
tests/test_integration_orchestrator.py::TestIntegrationCompleteness::test_all_modules_available PASSED [ 57%]
tests/test_integration_orchestrator.py::TestIntegrationCompleteness::test_integration_consistency PASSED [ 57%]
tests/test_intelligent_modules.py::TestASTAnalyzer::test_analyze_file PASSED [ 58%]
tests/test_intelligent_modules.py::TestASTAnalyzer::test_complexity_calculation PASSED [ 58%]
tests/test_intelligent_modules.py::TestASTAnalyzer::test_extract_classes PASSED [ 58%]
tests/test_intelligent_modules.py::TestASTAnalyzer::test_extract_functions PASSED [ 58%]
tests/test_intelligent_modules.py::TestPatternDetector::test_analyze_project_patterns PASSED [ 59%]
tests/test_intelligent_modules.py::TestPatternDetector::test_antipattern_detection PASSED [ 59%]
tests/test_intelligent_modules.py::TestPatternDetector::test_duplicate_detection PASSED [ 59%]
tests/test_intelligent_modules.py::TestArchitectureAnalyzer::test_analyze_entire_architecture PASSED [ 59%]
tests/test_intelligent_modules.py::TestArchitectureAnalyzer::test_dependency_analysis PASSED [ 59%]
tests/test_intelligent_modules.py::TestArchitectureAnalyzer::test_get_optimization_plan PASSED [ 60%]
tests/test_intelligent_modules.py::TestArchitectureAnalyzer::test_module_analysis PASSED [ 60%]
tests/test_intelligent_modules.py::TestPerformanceAnalyzer::test_analyze_project_performance PASSED [ 60%]
tests/test_intelligent_modules.py::TestPerformanceAnalyzer::test_get_performance_insights PASSED [ 60%]
tests/test_intelligent_modules.py::TestPerformanceAnalyzer::test_performance_issues_detection PASSED [ 61%]
tests/test_intelligent_modules.py::TestPerformanceAnalyzer::test_performance_metrics PASSED [ 61%]
tests/test_intelligent_modules.py::TestIntelligentAnalyzer::test_analyze_project_comprehensive PASSED [ 61%]
tests/test_intelligent_modules.py::TestIntelligentAnalyzer::test_get_learning_insights PASSED [ 61%]
tests/test_intelligent_modules.py::TestIntelligentAnalyzer::test_optimization_plan_creation PASSED [ 62%]
tests/test_intelligent_modules.py::TestIntelligentAnalyzer::test_overall_score_calculation PASSED [ 62%]
tests/test_intelligent_modules.py::TestIntelligentAnalyzer::test_recommendations_generation PASSED [ 62%]
tests/test_intelligent_simple.py::test_ast_analyzer PASSED               [ 62%]
tests/test_intelligent_simple.py::test_pattern_detector FAILED           [ 62%]
tests/test_intelligent_simple.py::test_architecture_analyzer FAILED      [ 63%]
tests/test_intelligent_simple.py::test_performance_analyzer FAILED       [ 63%]
tests/test_intelligent_system.py::test_intelligent_analyzer PASSED       [ 63%]
tests/test_intelligent_system.py::test_intelligent_memory PASSED         [ 63%]
tests/test_intelligent_system.py::test_intelligent_orchestrator PASSED   [ 64%]
tests/test_intelligent_system.py::test_integration PASSED                [ 64%]
tests/test_intelligent_system_simple.py::test_simple_analysis PASSED     [ 64%]
tests/test_lint_flake8.py::test_flake8_clean SKIPPED (Test désactivé...) [ 64%]
tests/test_logging_system.py::TestLoggingSystem::test_basic_logging_creation PASSED [ 65%]
tests/test_logging_system.py::TestLoggingSystem::test_advanced_logging_import PASSED [ 65%]
tests/test_logging_system.py::TestLoggingSystem::test_advanced_logging_functionality PASSED [ 65%]
tests/test_logging_system.py::TestLoggingSystem::test_log_file_rotation PASSED [ 65%]
tests/test_logging_system.py::TestLoggingSystem::test_log_levels PASSED  [ 65%]
tests/test_logging_system.py::TestLoggingSystem::test_log_format PASSED  [ 66%]
tests/test_logging_system.py::TestLoggingSystem::test_log_directory_creation PASSED [ 66%]
tests/test_logging_system.py::test_logging_configuration PASSED          [ 66%]
tests/test_multi_file_editor.py::test_apply_corrections_and_rollback PASSED [ 66%]
tests/test_multi_file_editor.py::test_apply_corrections_error PASSED     [ 67%]
tests/test_no_polluting_files.py::TestNoPollutingFiles::test_no_macos_hidden_files SKIPPED [ 67%]
tests/test_no_polluting_files.py::TestNoPollutingFiles::test_no_python_cache_files SKIPPED [ 67%]
tests/test_no_polluting_files.py::TestNoPollutingFiles::test_no_temp_files SKIPPED [ 67%]
tests/test_no_polluting_files.py::TestNoPollutingFiles::test_no_corrupted_files SKIPPED [ 68%]
tests/test_no_polluting_files.py::TestNoPollutingFiles::test_no_editor_files PASSED [ 68%]
tests/test_no_polluting_files.py::TestNoPollutingFiles::test_no_archive_files FAILED [ 68%]
tests/test_no_polluting_files.py::TestNoPollutingFiles::test_no_secret_files SKIPPED [ 68%]
tests/test_no_polluting_files.py::TestNoPollutingFiles::test_no_large_files FAILED [ 68%]
tests/test_no_polluting_files.py::TestNoPollutingFiles::test_no_duplicate_files SKIPPED [ 69%]
tests/test_no_polluting_files.py::TestNoPollutingFiles::test_no_empty_directories SKIPPED [ 69%]
tests/test_orchestrator_robotics.py::TestOrchestratorRobotics::test_industrialize_project_with_robotics SKIPPED [ 69%]
tests/test_orchestrator_robotics.py::TestOrchestratorRobotics::test_robotics_module_only SKIPPED [ 69%]
tests/test_orchestrator_robotics.py::TestOrchestratorRobotics::test_robotics_module_on_non_robotics_project SKIPPED [ 70%]
tests/test_orchestrator_robotics.py::TestOrchestratorRobotics::test_robotics_module_import SKIPPED [ 70%]
tests/test_orchestrator_robotics.py::TestOrchestratorRobotics::test_robotics_audit_method SKIPPED [ 70%]
tests/test_orchestrator_robotics.py::test_robotics_module_availability SKIPPED [ 70%]
tests/test_performance_optimized.py::TestPerformanceOptimized::test_analytics_basic_operations SKIPPED [ 71%]
tests/test_performance_optimized.py::TestPerformanceOptimized::test_analytics_instantiation SKIPPED [ 71%]
tests/test_performance_optimized.py::TestPerformanceOptimized::test_analytics_with_cache SKIPPED [ 71%]
tests/test_performance_optimized.py::TestPerformanceOptimized::test_audit_basic_operations SKIPPED [ 71%]
tests/test_performance_optimized.py::TestPerformanceOptimized::test_audit_instantiation SKIPPED [ 71%]
tests/test_performance_optimized.py::TestPerformanceOptimized::test_cleanup_basic_operations SKIPPED [ 72%]
tests/test_performance_optimized.py::TestPerformanceOptimized::test_cleanup_instantiation SKIPPED [ 72%]
tests/test_performance_optimized.py::TestPerformanceOptimized::test_memory_usage SKIPPED [ 72%]
tests/test_performance_optimized.py::TestPerformanceOptimized::test_parallel_operations SKIPPED [ 72%]
tests/test_performance_optimized.py::test_import_performance PASSED      [ 73%]
tests/test_performance_optimized.py::test_module_instantiation_performance SKIPPED [ 73%]
tests/test_phase2_integration.py::TestPhase2Integration::test_orchestrator_phase2_imports PASSED [ 73%]
tests/test_phase2_integration.py::TestPhase2Integration::test_phase2_backup_integration PASSED [ 73%]
tests/test_phase2_integration.py::TestPhase2Integration::test_phase2_error_handling_integration PASSED [ 74%]
tests/test_phase2_integration.py::TestPhase2Integration::test_phase2_validation_integration PASSED [ 74%]
tests/test_phase2_integration.py::TestPhase2Integration::test_phase2_backup_stats_integration PASSED [ 74%]
tests/test_phase2_integration.py::TestPhase2Integration::test_orchestrate_with_phase2_features PASSED [ 74%]
tests/test_phase2_integration.py::TestPhase2Integration::test_cli_standard_integration PASSED [ 75%]
tests/test_phase2_integration.py::TestPhase2Integration::test_error_codes_integration PASSED [ 75%]
tests/test_phase2_integration.py::TestPhase2Integration::test_error_handling_integration PASSED [ 75%]
tests/test_phase2_integration.py::TestPhase2Integration::test_backup_system_integration PASSED [ 75%]
tests/test_phase2_integration.py::TestPhase2Integration::test_phase2_fallback_when_not_available PASSED [ 75%]
tests/test_phase2_integration.py::TestPhase2Documentation::test_templates_documentation_exists FAILED [ 76%]
tests/test_phase2_integration.py::TestPhase2Documentation::test_prompts_documentation_exists PASSED [ 76%]
tests/test_phase2_integration.py::TestPhase2Documentation::test_phase2_implementation_documentation_exists FAILED [ 76%]
tests/test_phase2_integration.py::TestPhase2CLIScripts::test_backup_script_exists PASSED [ 76%]
tests/test_phase2_integration.py::TestPhase2CLIScripts::test_backup_script_content PASSED [ 77%]
tests/test_plugin_complet.py::test_vscode_installation PASSED            [ 77%]
tests/test_plugin_complet.py::test_plugin_compilation PASSED             [ 77%]
tests/test_plugin_complet.py::test_package_json PASSED                   [ 77%]
tests/test_plugin_complet.py::test_ai_server PASSED                      [ 78%]
tests/test_plugin_complet.py::test_apple_double_files PASSED             [ 78%]
tests/test_plugins.py::test_list_plugins PASSED                          [ 78%]
tests/test_plugins.py::test_load_plugin PASSED                           [ 78%]
tests/test_plugins.py::test_run_all_plugins PASSED                       [ 78%]
tests/test_plugins.py::test_export_docker_plugin PASSED                  [ 79%]
tests/test_plugins_validator.py::test_validate_plugin_ok PASSED          [ 79%]
tests/test_plugins_validator.py::test_validate_plugin_fail PASSED        [ 79%]
tests/test_predictive_cache.py::TestPredictiveCache::test_invalidate PASSED [ 79%]
tests/test_predictive_cache.py::TestPredictiveCache::test_pre_generate PASSED [ 80%]
tests/test_predictive_cache.py::TestPredictiveCache::test_predict_key PASSED [ 80%]
tests/test_predictive_cache.py::TestPredictiveCache::test_set_get PASSED [ 80%]
tests/test_predictive_cache.py::TestPredictiveCache::test_stats PASSED   [ 80%]
tests/test_predictive_cache.py::TestPredictiveCache::test_ttl PASSED     [ 81%]
tests/test_profils_utilisateur_avances.py::TestUserProfilesAdvanced::test_import_user_profiles SKIPPED [ 81%]
tests/test_profils_utilisateur_avances.py::TestUserProfilesAdvanced::test_profiles_functionality SKIPPED [ 81%]
tests/test_profils_utilisateur_avances.py::TestUserProfilesAdvanced::test_profiles_structure PASSED [ 81%]
tests/test_project_importer.py::test_project_import_concept PASSED       [ 81%]
tests/test_ready_check.py::test_check_ready_ok SKIPPED (Module Ready...) [ 82%]
tests/test_ready_check.py::test_check_ready_missing SKIPPED (Module ...) [ 82%]
tests/test_requirements_consistency.py::TestRequirementsConsistency::test_requirements_txt_exists PASSED [ 82%]
tests/test_requirements_consistency.py::TestRequirementsConsistency::test_requirements_txt_readable PASSED [ 82%]
tests/test_requirements_consistency.py::TestRequirementsConsistency::test_requirements_format PASSED [ 83%]
tests/test_requirements_consistency.py::TestRequirementsConsistency::test_essential_dependencies PASSED [ 83%]
tests/test_requirements_consistency.py::TestRequirementsConsistency::test_no_duplicate_dependencies SKIPPED [ 83%]
tests/test_requirements_consistency.py::TestRequirementsConsistency::test_pyproject_toml_exists PASSED [ 83%]
tests/test_requirements_consistency.py::TestRequirementsConsistency::test_pyproject_toml_readable PASSED [ 84%]
tests/test_requirements_consistency.py::TestRequirementsConsistency::test_requirements_vs_pyproject_consistency PASSED [ 84%]
tests/test_requirements_consistency.py::TestRequirementsConsistency::test_no_conflicting_versions PASSED [ 84%]
tests/test_requirements_consistency.py::TestRequirementsConsistency::test_no_obsolete_dependencies PASSED [ 84%]
tests/test_requirements_consistency.py::TestRequirementsConsistency::test_requirements_installable PASSED [ 84%]
tests/test_security_patterns.py::TestSecurityPatterns::test_no_hardcoded_passwords SKIPPED [ 85%]
tests/test_security_patterns.py::TestSecurityPatterns::test_no_sql_injection_patterns SKIPPED [ 85%]
tests/test_security_patterns.py::TestSecurityPatterns::test_no_eval_usage SKIPPED [ 85%]
tests/test_security_patterns.py::TestSecurityPatterns::test_no_shell_injection FAILED [ 85%]
tests/test_security_patterns.py::TestSecurityPatterns::test_no_debug_code SKIPPED [ 86%]
tests/test_security_patterns.py::TestSecurityPatterns::test_no_hardcoded_urls SKIPPED [ 86%]
tests/test_security_patterns.py::TestSecurityPatterns::test_no_weak_crypto SKIPPED [ 86%]
tests/test_templates_documentation.py::TestTemplatesDocumentation::test_templates_directory_exists PASSED [ 86%]
tests/test_templates_documentation.py::TestTemplatesDocumentation::test_docs_directory_exists PASSED [ 87%]
tests/test_templates_documentation.py::TestTemplatesDocumentation::test_readme_exists PASSED [ 87%]
tests/test_templates_documentation.py::TestTemplatesDocumentation::test_readme_content PASSED [ 87%]
tests/test_templates_documentation.py::TestTemplatesDocumentation::test_base_templates_function PASSED [ 87%]
tests/test_templates_documentation.py::TestTemplatesDocumentation::test_api_template_exists PASSED [ 87%]
tests/test_templates_documentation.py::TestTemplatesDocumentation::test_memory_template_exists PASSED [ 88%]
tests/test_templates_documentation.py::TestTemplatesDocumentation::test_tts_template_exists PASSED [ 88%]
tests/test_templates_documentation.py::TestTemplatesDocumentation::test_template_rendering PASSED [ 88%]
tests/test_templates_documentation.py::TestTemplatesDocumentation::test_template_files_exist PASSED [ 88%]
tests/test_templates_documentation.py::TestTemplatesDocumentation::test_template_files_content PASSED [ 89%]
tests/test_templates_documentation.py::TestTemplatesDocumentation::test_documentation_coverage PASSED [ 89%]
tests/test_templates_documentation.py::TestTemplatesDocumentation::test_variables_documentation PASSED [ 89%]
tests/test_templates_documentation.py::TestTemplatesDocumentation::test_examples_documentation PASSED [ 89%]
tests/test_templates_documentation.py::TestTemplatesDocumentation::test_troubleshooting_documentation PASSED [ 90%]
tests/test_templates_documentation.py::TestTemplatesDocumentation::test_template_structure PASSED [ 90%]
tests/test_templates_documentation.py::TestTemplatesDocumentation::test_template_variables_validation PASSED [ 90%]
tests/test_templates_documentation.py::TestTemplatesDocumentation::test_documentation_format PASSED [ 90%]
tests/test_templates_documentation.py::TestTemplatesDocumentation::test_documentation_links PASSED [ 90%]
tests/test_templates_documentation.py::TestTemplatesDocumentation::test_template_file_permissions PASSED [ 91%]
tests/test_templates_documentation.py::TestTemplatesDocumentation::test_documentation_encoding PASSED [ 91%]
tests/test_templates_documentation.py::TestTemplatesIntegration::test_full_template_workflow PASSED [ 91%]
tests/test_unified_orchestrator_complete.py::TestUnifiedOrchestratorComplete::test_orchestrator_initialization PASSED [ 91%]
tests/test_unified_orchestrator_complete.py::TestUnifiedOrchestratorComplete::test_database_initialization PASSED [ 92%]
tests/test_unified_orchestrator_complete.py::TestUnifiedOrchestratorComplete::test_orchestrate_project_complete_basic PASSED [ 92%]
tests/test_unified_orchestrator_complete.py::TestUnifiedOrchestratorComplete::test_orchestrate_project_complete_with_industrialization PASSED [ 92%]
tests/test_unified_orchestrator_complete.py::TestUnifiedOrchestratorComplete::test_run_audit PASSED [ 92%]
tests/test_unified_orchestrator_complete.py::TestUnifiedOrchestratorComplete::test_run_linting PASSED [ 93%]
tests/test_unified_orchestrator_complete.py::TestUnifiedOrchestratorComplete::test_run_security_audit PASSED [ 93%]
tests/test_unified_orchestrator_complete.py::TestUnifiedOrchestratorComplete::test_run_analytics PASSED [ 93%]
tests/test_unified_orchestrator_complete.py::TestUnifiedOrchestratorComplete::test_run_cleanup PASSED [ 93%]
tests/test_unified_orchestrator_complete.py::TestUnifiedOrchestratorComplete::test_run_documentation PASSED [ 93%]
tests/test_unified_orchestrator_complete.py::TestUnifiedOrchestratorComplete::test_run_testing PASSED [ 94%]
tests/test_unified_orchestrator_complete.py::TestUnifiedOrchestratorComplete::test_run_cicd PASSED [ 94%]
tests/test_unified_orchestrator_complete.py::TestUnifiedOrchestratorComplete::test_run_robotics_audit PASSED [ 94%]
tests/test_unified_orchestrator_complete.py::TestUnifiedOrchestratorComplete::test_generate_predictions PASSED [ 94%]
tests/test_unified_orchestrator_complete.py::TestUnifiedOrchestratorComplete::test_generate_optimizations PASSED [ 95%]
tests/test_unified_orchestrator_complete.py::TestUnifiedOrchestratorComplete::test_learn_from_results PASSED [ 95%]
tests/test_unified_orchestrator_complete.py::TestUnifiedOrchestratorComplete::test_generate_unified_report PASSED [ 95%]
tests/test_unified_orchestrator_complete.py::TestUnifiedOrchestratorComplete::test_save_unified_results PASSED [ 95%]
tests/test_unified_orchestrator_complete.py::TestUnifiedOrchestratorComplete::test_get_orchestration_insights PASSED [ 96%]
tests/test_unified_orchestrator_complete.py::TestUnifiedOrchestratorComplete::test_phase2_backup PASSED [ 96%]
tests/test_unified_orchestrator_complete.py::TestUnifiedOrchestratorComplete::test_phase2_error_handling PASSED [ 96%]
tests/test_unified_orchestrator_complete.py::TestUnifiedOrchestratorComplete::test_validate_phase2_inputs PASSED [ 96%]
tests/test_unified_orchestrator_complete.py::TestUnifiedOrchestratorComplete::test_get_phase2_backup_stats PASSED [ 96%]
tests/test_unified_orchestrator_complete.py::TestUnifiedOrchestratorComplete::test_orchestrate_with_phase2_features PASSED [ 97%]
tests/test_unified_orchestrator_complete.py::TestUnifiedOrchestratorComplete::test_error_handling_in_industrialization PASSED [ 97%]
tests/test_unified_orchestrator_complete.py::TestUnifiedOrchestratorComplete::test_cli_entry_point PASSED [ 97%]
tests/test_unified_orchestrator_complete.py::TestUnifiedOrchestratorComplete::test_main_entry_point PASSED [ 97%]
tests/test_unified_orchestrator_complete.py::TestUnifiedOrchestratorComplete::test_main_with_args PASSED [ 98%]
tests/test_unified_orchestrator_complete.py::TestUnifiedOrchestratorComplete::test_orchestrator_auto_backup PASSED [ 98%]
tests/test_workspace_organization.py::TestWorkspaceOrganization::test_scan_workspace PASSED [ 98%]
tests/test_workspace_organization.py::TestWorkspaceOrganization::test_pattern_matching PASSED [ 98%]
tests/test_workspace_organization.py::TestWorkspaceOrganization::test_organize_files_dry_run PASSED [ 99%]
tests/test_workspace_organization.py::TestWorkspaceOrganization::test_organize_files_actual PASSED [ 99%]
tests/test_workspace_organization.py::TestWorkspaceOrganization::test_cleanup_temp_files PASSED [ 99%]
tests/test_workspace_organization.py::TestWorkspaceOrganization::test_validate_organization PASSED [ 99%]
tests/test_workspace_organization.py::TestWorkspaceOrganization::test_generate_organization_report PASSED [100%]

=================================== FAILURES ===================================
_____________________________ test_cli_robustesse ______________________________
tests/integration/test_cli_robustesse.py:17: in test_cli_robustesse
    result = subprocess.run([
/opt/homebrew/opt/pyenv/versions/3.10.14/lib/python3.10/subprocess.py:505: in run
    stdout, stderr = process.communicate(input, timeout=timeout)
/opt/homebrew/opt/pyenv/versions/3.10.14/lib/python3.10/subprocess.py:1154: in communicate
    stdout, stderr = self._communicate(input, endtime, timeout)
/opt/homebrew/opt/pyenv/versions/3.10.14/lib/python3.10/subprocess.py:2014: in _communicate
    self._check_timeout(endtime, orig_timeout,
/opt/homebrew/opt/pyenv/versions/3.10.14/lib/python3.10/subprocess.py:1198: in _check_timeout
    raise TimeoutExpired(
E   subprocess.TimeoutExpired: Command '['/opt/homebrew/opt/pyenv/versions/3.10.14/bin/python', 'athalia_core/main.py', '--help']' timed out after 10 seconds
_ test_critical_function_benchmark[athalia_core.athalia_orchestrator-AthaliaOrchestrator-False] _
tests/test_benchmark_critical.py:20: in test_critical_function_benchmark
    func = import_critical_function(module_name, func_name)
tests/test_benchmark_critical.py:14: in import_critical_function
    module = importlib.import_module(module_name)
/opt/homebrew/opt/pyenv/versions/3.10.14/lib/python3.10/importlib/__init__.py:126: in import_module
    return _bootstrap._gcd_import(name[level:], package, level)
<frozen importlib._bootstrap>:1050: in _gcd_import
    ???
<frozen importlib._bootstrap>:1027: in _find_and_load
    ???
<frozen importlib._bootstrap>:1004: in _find_and_load_unlocked
    ???
E   ModuleNotFoundError: No module named 'athalia_core.athalia_orchestrator'
__________________ TestCIBasic.test_github_workflow_structure __________________
tests/test_ci_basic.py:158: in test_github_workflow_structure
    assert os.path.exists(github_dir)
E   AssertionError: assert False
E    +  where False = <function exists at 0x10264e320>('/var/folders/7j/xgp8mds53ms6blyzf8g4173m0000gn/T/tmpydcuesbt/test_project/.github')
E    +    where <function exists at 0x10264e320> = <module 'posixpath' from '/opt/homebrew/opt/pyenv/versions/3.10.14/lib/python3.10/posixpath.py'>.exists
E    +      where <module 'posixpath' from '/opt/homebrew/opt/pyenv/versions/3.10.14/lib/python3.10/posixpath.py'> = os.path

During handling of the above exception, another exception occurred:
tests/test_ci_basic.py:176: in test_github_workflow_structure
    assert "ci" in str(e).lower() or "error" in str(e).lower()
E   assert ('ci' in "assert false\n +  where false = <function exists at 0x10264e320>('/var/folders/7j/xgp8mds53ms6blyzf8g4173m0000gn/t/tmpydcuesbt/test_project/.github')\n +    where <function exists at 0x10264e320> = <module 'posixpath' from '/opt/homebrew/opt/pyenv/versions/3.10.14/lib/python3.10/posixpath.py'>.exists\n +      where <module 'posixpath' from '/opt/homebrew/opt/pyenv/versions/3.10.14/lib/python3.10/posixpath.py'> = os.path" or 'error' in "assert false\n +  where false = <function exists at 0x10264e320>('/var/folders/7j/xgp8mds53ms6blyzf8g4173m0000gn/t/tmpydcuesbt/test_project/.github')\n +    where <function exists at 0x10264e320> = <module 'posixpath' from '/opt/homebrew/opt/pyenv/versions/3.10.14/lib/python3.10/posixpath.py'>.exists\n +      where <module 'posixpath' from '/opt/homebrew/opt/pyenv/versions/3.10.14/lib/python3.10/posixpath.py'> = os.path")
E    +  where "assert false\n +  where false = <function exists at 0x10264e320>('/var/folders/7j/xgp8mds53ms6blyzf8g4173m0000gn/t/tmpydcuesbt/test_project/.github')\n +    where <function exists at 0x10264e320> = <module 'posixpath' from '/opt/homebrew/opt/pyenv/versions/3.10.14/lib/python3.10/posixpath.py'>.exists\n +      where <module 'posixpath' from '/opt/homebrew/opt/pyenv/versions/3.10.14/lib/python3.10/posixpath.py'> = os.path" = <built-in method lower of str object at 0x10c77cb70>()
E    +    where <built-in method lower of str object at 0x10c77cb70> = "assert False\n +  where False = <function exists at 0x10264e320>('/var/folders/7j/xgp8mds53ms6blyzf8g4173m0000gn/T/tmpydcuesbt/test_project/.github')\n +    where <function exists at 0x10264e320> = <module 'posixpath' from '/opt/homebrew/opt/pyenv/versions/3.10.14/lib/python3.10/posixpath.py'>.exists\n +      where <module 'posixpath' from '/opt/homebrew/opt/pyenv/versions/3.10.14/lib/python3.10/posixpath.py'> = os.path".lower
E    +      where "assert False\n +  where False = <function exists at 0x10264e320>('/var/folders/7j/xgp8mds53ms6blyzf8g4173m0000gn/T/tmpydcuesbt/test_project/.github')\n +    where <function exists at 0x10264e320> = <module 'posixpath' from '/opt/homebrew/opt/pyenv/versions/3.10.14/lib/python3.10/posixpath.py'>.exists\n +      where <module 'posixpath' from '/opt/homebrew/opt/pyenv/versions/3.10.14/lib/python3.10/posixpath.py'> = os.path" = str(AssertionError("assert False\n +  where False = <function exists at 0x10264e320>('/var/folders/7j/xgp8mds53ms6blyzf8g4173m0000gn/T/tmpydcuesbt/test_project/.github')\n +    where <function exists at 0x10264e320> = <module 'posixpath' from '/opt/homebrew/opt/pyenv/versions/3.10.14/lib/python3.10/posixpath.py'>.exists\n +      where <module 'posixpath' from '/opt/homebrew/opt/pyenv/versions/3.10.14/lib/python3.10/posixpath.py'> = os.path"))
E    +  and   "assert false\n +  where false = <function exists at 0x10264e320>('/var/folders/7j/xgp8mds53ms6blyzf8g4173m0000gn/t/tmpydcuesbt/test_project/.github')\n +    where <function exists at 0x10264e320> = <module 'posixpath' from '/opt/homebrew/opt/pyenv/versions/3.10.14/lib/python3.10/posixpath.py'>.exists\n +      where <module 'posixpath' from '/opt/homebrew/opt/pyenv/versions/3.10.14/lib/python3.10/posixpath.py'> = os.path" = <built-in method lower of str object at 0x10c77cb70>()
E    +    where <built-in method lower of str object at 0x10c77cb70> = "assert False\n +  where False = <function exists at 0x10264e320>('/var/folders/7j/xgp8mds53ms6blyzf8g4173m0000gn/T/tmpydcuesbt/test_project/.github')\n +    where <function exists at 0x10264e320> = <module 'posixpath' from '/opt/homebrew/opt/pyenv/versions/3.10.14/lib/python3.10/posixpath.py'>.exists\n +      where <module 'posixpath' from '/opt/homebrew/opt/pyenv/versions/3.10.14/lib/python3.10/posixpath.py'> = os.path".lower
E    +      where "assert False\n +  where False = <function exists at 0x10264e320>('/var/folders/7j/xgp8mds53ms6blyzf8g4173m0000gn/T/tmpydcuesbt/test_project/.github')\n +    where <function exists at 0x10264e320> = <module 'posixpath' from '/opt/homebrew/opt/pyenv/versions/3.10.14/lib/python3.10/posixpath.py'>.exists\n +      where <module 'posixpath' from '/opt/homebrew/opt/pyenv/versions/3.10.14/lib/python3.10/posixpath.py'> = os.path" = str(AssertionError("assert False\n +  where False = <function exists at 0x10264e320>('/var/folders/7j/xgp8mds53ms6blyzf8g4173m0000gn/T/tmpydcuesbt/test_project/.github')\n +    where <function exists at 0x10264e320> = <module 'posixpath' from '/opt/homebrew/opt/pyenv/versions/3.10.14/lib/python3.10/posixpath.py'>.exists\n +      where <module 'posixpath' from '/opt/homebrew/opt/pyenv/versions/3.10.14/lib/python3.10/posixpath.py'> = os.path"))
----------------------------- Captured stdout call -----------------------------
[DEBUG CI] Fichier généré : /var/folders/7j/xgp8mds53ms6blyzf8g4173m0000gn/T/tmpydcuesbt/test_project/.f/f/ci.f(f (exists: True)
___________ TestCorrectionOptimizerOptimized.test_basic_corrections ____________
tests/test_correction_optimizer_optimized.py:70: in test_basic_corrections
    self.assertIn(expected, result.corrected_content)
E   AssertionError: 'def test_function(x, y):' not found in 'def test_function(x, y)):\nresult = x + y\n    return result'
------------------------------ Captured log call -------------------------------
INFO     athalia.correction:logger_advanced.py:162 CORRECTION | test_spacing_issues.py | optimized_multi_pass | False | 0.00s
WARNING  athalia.correction:logger_advanced.py:165 CORRECTION_FAILED | test_spacing_issues.py | optimized_multi_pass
___________ TestCorrectionOptimizerOptimized.test_complex_correction ___________
tests/test_correction_optimizer_optimized.py:114: in test_complex_correction
    self.assertTrue(result.success)
E   AssertionError: False is not true
------------------------------ Captured log call -------------------------------
INFO     athalia.correction:logger_advanced.py:162 CORRECTION | test_complex.py | optimized_multi_pass | False | 0.00s
WARNING  athalia.correction:logger_advanced.py:165 CORRECTION_FAILED | test_complex.py | optimized_multi_pass
_________ TestCorrectionOptimizerOptimized.test_contextual_corrections _________
tests/test_correction_optimizer_optimized.py:94: in test_contextual_corrections
    self.assertEqual(result.original_content, result.corrected_content)
E   AssertionError: 'def test_function():\n    x = 1\n    y = 2\n    return x + y' != 'def test_function()):\nx = 1\ny = 2\n    return x + y'
E   - def test_function():
E   + def test_function()):
E   ?                    +
E   -     x = 1
E   ? ----
E   + x = 1
E   -     y = 2
E   ? ----
E   + y = 2
E         return x + y
------------------------------ Captured log call -------------------------------
INFO     athalia.correction:logger_advanced.py:162 CORRECTION | test_undefined_variable.py | optimized_multi_pass | False | 0.00s
WARNING  athalia.correction:logger_advanced.py:165 CORRECTION_FAILED | test_undefined_variable.py | optimized_multi_pass
INFO     athalia.correction:logger_advanced.py:162 CORRECTION | test_valid_code.py | optimized_multi_pass | False | 0.00s
WARNING  athalia.correction:logger_advanced.py:165 CORRECTION_FAILED | test_valid_code.py | optimized_multi_pass
_________ TestCorrectionOptimizerOptimized.test_convenience_functions __________
tests/test_correction_optimizer_optimized.py:233: in test_convenience_functions
    self.assertTrue(result.success)
E   AssertionError: False is not true
------------------------------ Captured log call -------------------------------
INFO     athalia.correction:logger_advanced.py:162 CORRECTION | test_convenience.py | optimized_multi_pass | False | 0.00s
WARNING  athalia.correction:logger_advanced.py:165 CORRECTION_FAILED | test_convenience.py | optimized_multi_pass
_____________ TestCorrectionOptimizerOptimized.test_error_handling _____________
tests/test_correction_optimizer_optimized.py:206: in test_error_handling
    self.assertFalse(result.success)
E   AssertionError: True is not false
------------------------------ Captured log call -------------------------------
INFO     athalia.correction:logger_advanced.py:162 CORRECTION | test_empty_code.py | optimized_multi_pass | True | 0.00s
___________ TestCorrectionOptimizerIntegration.test_with_real_files ____________
tests/test_correction_optimizer_optimized.py:281: in test_with_real_files
    self.assertTrue(result.success)
E   AssertionError: False is not true
------------------------------ Captured log call -------------------------------
INFO     athalia.correction:logger_advanced.py:162 CORRECTION | /var/folders/7j/xgp8mds53ms6blyzf8g4173m0000gn/T/tmp_1azjbb_/test_file1.py | optimized_multi_pass | False | 0.00s
WARNING  athalia.correction:logger_advanced.py:165 CORRECTION_FAILED | /var/folders/7j/xgp8mds53ms6blyzf8g4173m0000gn/T/tmp_1azjbb_/test_file1.py | optimized_multi_pass
____________________________ test_pattern_detector _____________________________
tests/test_intelligent_simple.py:82: in test_pattern_detector
    shutil.rmtree(test_dir)
/opt/homebrew/opt/pyenv/versions/3.10.14/lib/python3.10/shutil.py:725: in rmtree
    _rmtree_safe_fd(fd, path, onerror)
/opt/homebrew/opt/pyenv/versions/3.10.14/lib/python3.10/shutil.py:681: in _rmtree_safe_fd
    onerror(os.unlink, fullname, sys.exc_info())
/opt/homebrew/opt/pyenv/versions/3.10.14/lib/python3.10/shutil.py:679: in _rmtree_safe_fd
    os.unlink(entry.name, dir_fd=topfd)
E   FileNotFoundError: [Errno 2] No such file or directory: '._README.md'
----------------------------- Captured stdout call -----------------------------
🔍 Test du détecteur de patterns...
✅ Pattern Detector fonctionne - 2 patterns détectés
__________________________ test_architecture_analyzer __________________________
tests/test_intelligent_simple.py:116: in test_architecture_analyzer
    shutil.rmtree(test_dir)
/opt/homebrew/opt/pyenv/versions/3.10.14/lib/python3.10/shutil.py:725: in rmtree
    _rmtree_safe_fd(fd, path, onerror)
/opt/homebrew/opt/pyenv/versions/3.10.14/lib/python3.10/shutil.py:658: in _rmtree_safe_fd
    _rmtree_safe_fd(dirfd, fullname, onerror)
/opt/homebrew/opt/pyenv/versions/3.10.14/lib/python3.10/shutil.py:681: in _rmtree_safe_fd
    onerror(os.unlink, fullname, sys.exc_info())
/opt/homebrew/opt/pyenv/versions/3.10.14/lib/python3.10/shutil.py:679: in _rmtree_safe_fd
    os.unlink(entry.name, dir_fd=topfd)
E   FileNotFoundError: [Errno 2] No such file or directory: '._test.py'
----------------------------- Captured stdout call -----------------------------
🏗️ Test de l'analyseur d'architecture...
✅ Architecture Analyzer fonctionne - 1 modules analysés
__________________________ test_performance_analyzer ___________________________
tests/test_intelligent_simple.py:147: in test_performance_analyzer
    shutil.rmtree(test_dir)
/opt/homebrew/opt/pyenv/versions/3.10.14/lib/python3.10/shutil.py:725: in rmtree
    _rmtree_safe_fd(fd, path, onerror)
/opt/homebrew/opt/pyenv/versions/3.10.14/lib/python3.10/shutil.py:681: in _rmtree_safe_fd
    onerror(os.unlink, fullname, sys.exc_info())
/opt/homebrew/opt/pyenv/versions/3.10.14/lib/python3.10/shutil.py:679: in _rmtree_safe_fd
    os.unlink(entry.name, dir_fd=topfd)
E   FileNotFoundError: [Errno 2] No such file or directory: '._README.md'
----------------------------- Captured stdout call -----------------------------
⚡ Test de l'analyseur de performance...
✅ Performance Analyzer fonctionne - Score: 100.0
__________________ TestNoPollutingFiles.test_no_archive_files __________________
tests/test_no_polluting_files.py:119: in test_no_archive_files
    pytest.fail(
E   Failed: Fichiers d'archive trouvés:
E   ./.venv/lib/python3.10/site-packages/dateutil/zoneinfo/dateutil-zoneinfo.tar.gz
___________________ TestNoPollutingFiles.test_no_large_files ___________________
tests/test_no_polluting_files.py:157: in test_no_large_files
    pytest.fail(
E   Failed: Fichiers trop volumineux trouvés:
E   ./docs/API.md
E   ./docs/archive/20250726_cleanup/API_original_16MB.md
E   ./.venv/lib/python3.10/site-packages/pyarrow/libarrow.2100.dylib
E   ./.venv/lib/python3.10/site-packages/pyarrow/libarrow_compute.2100.dylib
E   ./.venv/lib/python3.10/site-packages/pyarrow/libarrow_flight.2100.dylib
E   ./.venv/lib/python3.10/site-packages/pydeck/nbextension/static/index.js.map
E   ./.venv/share/jupyter/nbextensions/pydeck/index.js.map
_________ TestPhase2Documentation.test_templates_documentation_exists __________
tests/test_phase2_integration.py:224: in test_templates_documentation_exists
    assert "## 📋 **Vue d'ensemble**" in content
E   assert "## 📋 **Vue d'ensemble**" in '# 🎨 Documentation des Templates Athalia\n\n## 📋 Vue d\'ensemble\n\nLes templates Athalia sont des modèles de code pré-configurés qui permettent de générer rapidement des projets avec une architecture standardisée et des bonnes pratiques intégrées.\n\n## 🏗️ Architecture des Templates\n\n### Structure des Templates\n```\ntemplates/\n├── main.py.j2          # Point d\'entrée principal\n├── memory.py.j2        # Système de mémoire\n├── tts.py.j2          # Synthèse vocale\n└── api/\n    └── main.py.j2     # API REST\n```\n\n### Variables Disponibles\n\n#### Variables Globales\n- `project_name` : Nom du projet\n- `project_description` : Description du projet\n- `author` : Auteur du projet\n- `version` : Version du projet\n- `description` : Description du projet\n\n#### Variables Spécifiques\n- `api_framework` : Framework API (flask, fastapi, django)\n- `endpoints` : Liste des endpoints API\n- `memory_type` : Type de mémoire (redis, sqlite, file)\n- `tts_engine` : Moteur TTS (gtts, pyttsx3, azure)\n\n## 🔧 Utilisation des Templates\n\n### Génération de Projet\n```python\nfrom athalia_core.templates.base_templates import get_base_templates\n\ntemplates = get_base_templates()\napi_templa...="fr"\n)\n```\n\n## 🔍 Validation des Templates\n\n### Tests Automatiques\nLes templates sont validés automatiquement :\n- Syntaxe Jinja2 correcte\n- Variables requises définies\n- Génération de code valide\n\n### Tests Manuels\n```bash\n# Tester un template\npython -m pytest tests/test_templates_documentation.py -v\n```\n\n## 🚨 Dépannage\n\n### Problèmes Courants\n\n### Erreurs Communes\n\n#### Variable Manquante\n```\nError: Variable \'project_name\' not defined\n```\n**Solution :** Définir toutes les variables requises\n\n#### Template Non Trouvé\n```\nError: Template \'api/main.py\' not found\n```\n**Solution :** Vérifier que le template existe dans `templates/`\n\n#### Rendu Incorrect\n```\nError: Template rendering failed\n```\n**Solution :** Vérifier la syntaxe Jinja2 du template\n\n### Bonnes Pratiques\n\n1. **Toujours définir les variables requises**\n2. **Tester les templates avant utilisation**\n3. **Documenter les nouvelles variables**\n4. **Valider le code généré**\n\n## 📚 Références\n\n- [Documentation Jinja2](https://jinja.palletsprojects.com/)\n- [Guide des Templates](https://docs.athalia.dev/templates)\n- [Exemples de Projets](https://github.com/athalia/examples) '
___ TestPhase2Documentation.test_phase2_implementation_documentation_exists ____
tests/test_phase2_integration.py:240: in test_phase2_implementation_documentation_exists
    assert phase2_doc.exists(), "Documentation Phase 2 manquante"
E   AssertionError: Documentation Phase 2 manquante
E   assert False
E    +  where False = exists()
E    +    where exists = PosixPath('docs/PHASE2_IMPLEMENTATION.md').exists
_________________ TestSecurityPatterns.test_no_shell_injection _________________
tests/test_security_patterns.py:145: in test_no_shell_injection
    pytest.fail(
E   Failed: Injections shell trouvées:
E   cleanup_documentation.py: ['os.system(f"du -sh {args.docs_dir}']
E   cleanup_old_data.py: ['os.system(f"du -sh {args.data_dir}']
E   img.py: ['subprocess.Popen([\'fc-list\', f"{name}:style={style}']
=============================== warnings summary ===============================
tests/test_complet_athalia_imports.py:19
  /Volumes/T7/athalia-dev-setup/tests/test_complet_athalia_imports.py:19: PytestCollectionWarning: cannot collect test class 'TestImportsPython' because it has a __init__ constructor (from: tests/test_complet_athalia_imports.py)
    class TestImportsPython:

tests/test_complet_athalia_syntax.py:19
  /Volumes/T7/athalia-dev-setup/tests/test_complet_athalia_syntax.py:19: PytestCollectionWarning: cannot collect test class 'TestSyntaxPython' because it has a __init__ constructor (from: tests/test_complet_athalia_syntax.py)
    class TestSyntaxPython:

tests/test_performance_optimized.py:74
  /Volumes/T7/athalia-dev-setup/tests/test_performance_optimized.py:74: PytestUnknownMarkWarning: Unknown pytest.mark.fast - is this a typo?  You can register custom marks to avoid this warning - for details, see https://docs.pytest.org/en/stable/how-to/mark.html
    @pytest.mark.fast

tests/test_performance_optimized.py:86
  /Volumes/T7/athalia-dev-setup/tests/test_performance_optimized.py:86: PytestUnknownMarkWarning: Unknown pytest.mark.fast - is this a typo?  You can register custom marks to avoid this warning - for details, see https://docs.pytest.org/en/stable/how-to/mark.html
    @pytest.mark.fast

tests/test_performance_optimized.py:98
  /Volumes/T7/athalia-dev-setup/tests/test_performance_optimized.py:98: PytestUnknownMarkWarning: Unknown pytest.mark.fast - is this a typo?  You can register custom marks to avoid this warning - for details, see https://docs.pytest.org/en/stable/how-to/mark.html
    @pytest.mark.fast

tests/test_performance_optimized.py:110
  /Volumes/T7/athalia-dev-setup/tests/test_performance_optimized.py:110: PytestUnknownMarkWarning: Unknown pytest.mark.fast - is this a typo?  You can register custom marks to avoid this warning - for details, see https://docs.pytest.org/en/stable/how-to/mark.html
    @pytest.mark.fast

tests/test_performance_optimized.py:122
  /Volumes/T7/athalia-dev-setup/tests/test_performance_optimized.py:122: PytestUnknownMarkWarning: Unknown pytest.mark.fast - is this a typo?  You can register custom marks to avoid this warning - for details, see https://docs.pytest.org/en/stable/how-to/mark.html
    @pytest.mark.fast

tests/test_performance_optimized.py:134
  /Volumes/T7/athalia-dev-setup/tests/test_performance_optimized.py:134: PytestUnknownMarkWarning: Unknown pytest.mark.fast - is this a typo?  You can register custom marks to avoid this warning - for details, see https://docs.pytest.org/en/stable/how-to/mark.html
    @pytest.mark.fast

tests/test_performance_optimized.py:146
  /Volumes/T7/athalia-dev-setup/tests/test_performance_optimized.py:146: PytestUnknownMarkWarning: Unknown pytest.mark.medium - is this a typo?  You can register custom marks to avoid this warning - for details, see https://docs.pytest.org/en/stable/how-to/mark.html
    @pytest.mark.medium

tests/test_performance_optimized.py:168
  /Volumes/T7/athalia-dev-setup/tests/test_performance_optimized.py:168: PytestUnknownMarkWarning: Unknown pytest.mark.medium - is this a typo?  You can register custom marks to avoid this warning - for details, see https://docs.pytest.org/en/stable/how-to/mark.html
    @pytest.mark.medium

tests/test_performance_optimized.py:202
  /Volumes/T7/athalia-dev-setup/tests/test_performance_optimized.py:202: PytestUnknownMarkWarning: Unknown pytest.mark.slow - is this a typo?  You can register custom marks to avoid this warning - for details, see https://docs.pytest.org/en/stable/how-to/mark.html
    @pytest.mark.slow

tests/test_performance_optimized.py:235
  /Volumes/T7/athalia-dev-setup/tests/test_performance_optimized.py:235: PytestUnknownMarkWarning: Unknown pytest.mark.fast - is this a typo?  You can register custom marks to avoid this warning - for details, see https://docs.pytest.org/en/stable/how-to/mark.html
    @pytest.mark.fast

tests/test_performance_optimized.py:252
  /Volumes/T7/athalia-dev-setup/tests/test_performance_optimized.py:252: PytestUnknownMarkWarning: Unknown pytest.mark.fast - is this a typo?  You can register custom marks to avoid this warning - for details, see https://docs.pytest.org/en/stable/how-to/mark.html
    @pytest.mark.fast

tests/test_advanced_analytics_unit.py: 3 warnings
tests/test_all_orchestrators.py: 2 warnings
tests/test_auto_documenter_unit.py: 1 warning
tests/test_complet_athalia_imports.py: 2 warnings
tests/test_complet_athalia_syntax.py: 2 warnings
tests/test_intelligent_system_simple.py: 2 warnings
  <unknown>:54: DeprecationWarning: invalid escape sequence '\;'

tests/test_advanced_analytics_unit.py: 3 warnings
tests/test_all_orchestrators.py: 2 warnings
tests/test_auto_documenter_unit.py: 1 warning
tests/test_complet_athalia_imports.py: 2 warnings
tests/test_complet_athalia_syntax.py: 2 warnings
tests/test_intelligent_system_simple.py: 2 warnings
  <unknown>:184: DeprecationWarning: invalid escape sequence '\;'

tests/test_all_orchestrators.py::test_level_1_analyzer
  /opt/homebrew/opt/pyenv/versions/3.10.14/lib/python3.10/site-packages/_pytest/python.py:161: PytestReturnNotNoneWarning: Test functions should return None, but tests/test_all_orchestrators.py::test_level_1_analyzer returned <class 'tuple'>.
  Did you mean to use `assert` instead of `return`?
  See https://docs.pytest.org/en/stable/how-to/assert.html#return-not-none for more information.
    warnings.warn(

tests/test_all_orchestrators.py::test_level_2_orchestrator
  /opt/homebrew/opt/pyenv/versions/3.10.14/lib/python3.10/site-packages/_pytest/python.py:161: PytestReturnNotNoneWarning: Test functions should return None, but tests/test_all_orchestrators.py::test_level_2_orchestrator returned <class 'tuple'>.
  Did you mean to use `assert` instead of `return`?
  See https://docs.pytest.org/en/stable/how-to/assert.html#return-not-none for more information.
    warnings.warn(

tests/test_all_orchestrators.py::test_level_3_coordinator
  /opt/homebrew/opt/pyenv/versions/3.10.14/lib/python3.10/site-packages/_pytest/python.py:161: PytestReturnNotNoneWarning: Test functions should return None, but tests/test_all_orchestrators.py::test_level_3_coordinator returned <class 'tuple'>.
  Did you mean to use `assert` instead of `return`?
  See https://docs.pytest.org/en/stable/how-to/assert.html#return-not-none for more information.
    warnings.warn(

tests/test_all_orchestrators.py::test_integration
  /opt/homebrew/opt/pyenv/versions/3.10.14/lib/python3.10/site-packages/_pytest/python.py:161: PytestReturnNotNoneWarning: Test functions should return None, but tests/test_all_orchestrators.py::test_integration returned <class 'tuple'>.
  Did you mean to use `assert` instead of `return`?
  See https://docs.pytest.org/en/stable/how-to/assert.html#return-not-none for more information.
    warnings.warn(

tests/test_benchmark_critical.py::test_critical_function_benchmark[athalia_core.athalia_orchestrator-AthaliaOrchestrator-False]
  tests/test_benchmark_critical.py:17: PytestBenchmarkWarning: Benchmark fixture was not used at all in this test!
    @pytest.mark.benchmark(group="critical_functions")

tests/test_correction.py::test_generation_improvement
  /opt/homebrew/opt/pyenv/versions/3.10.14/lib/python3.10/site-packages/_pytest/python.py:161: PytestReturnNotNoneWarning: Test functions should return None, but tests/test_correction.py::test_generation_improvement returned <class 'dict'>.
  Did you mean to use `assert` instead of `return`?
  See https://docs.pytest.org/en/stable/how-to/assert.html#return-not-none for more information.
    warnings.warn(

tests/test_correction_optimizer_optimized.py::TestCorrectionOptimizerOptimized::test_basic_corrections
  /Volumes/T7/athalia-dev-setup/tests/test_correction_optimizer_optimized.py:67: UserWarning: Correction non appliquée, voir logs.
    warnings.warn("Correction non appliquée, voir logs.")

tests/test_final_validation.py::test_ast_analyzer
  /opt/homebrew/opt/pyenv/versions/3.10.14/lib/python3.10/site-packages/_pytest/python.py:161: PytestReturnNotNoneWarning: Test functions should return None, but tests/test_final_validation.py::test_ast_analyzer returned <class 'bool'>.
  Did you mean to use `assert` instead of `return`?
  See https://docs.pytest.org/en/stable/how-to/assert.html#return-not-none for more information.
    warnings.warn(

tests/test_final_validation.py::test_pattern_detector
  /opt/homebrew/opt/pyenv/versions/3.10.14/lib/python3.10/site-packages/_pytest/python.py:161: PytestReturnNotNoneWarning: Test functions should return None, but tests/test_final_validation.py::test_pattern_detector returned <class 'bool'>.
  Did you mean to use `assert` instead of `return`?
  See https://docs.pytest.org/en/stable/how-to/assert.html#return-not-none for more information.
    warnings.warn(

tests/test_final_validation.py::test_architecture_analyzer
  /opt/homebrew/opt/pyenv/versions/3.10.14/lib/python3.10/site-packages/_pytest/python.py:161: PytestReturnNotNoneWarning: Test functions should return None, but tests/test_final_validation.py::test_architecture_analyzer returned <class 'bool'>.
  Did you mean to use `assert` instead of `return`?
  See https://docs.pytest.org/en/stable/how-to/assert.html#return-not-none for more information.
    warnings.warn(

tests/test_final_validation.py::test_performance_analyzer
  /opt/homebrew/opt/pyenv/versions/3.10.14/lib/python3.10/site-packages/_pytest/python.py:161: PytestReturnNotNoneWarning: Test functions should return None, but tests/test_final_validation.py::test_performance_analyzer returned <class 'bool'>.
  Did you mean to use `assert` instead of `return`?
  See https://docs.pytest.org/en/stable/how-to/assert.html#return-not-none for more information.
    warnings.warn(

tests/test_final_validation.py::test_intelligent_analyzer
  /opt/homebrew/opt/pyenv/versions/3.10.14/lib/python3.10/site-packages/_pytest/python.py:161: PytestReturnNotNoneWarning: Test functions should return None, but tests/test_final_validation.py::test_intelligent_analyzer returned <class 'bool'>.
  Did you mean to use `assert` instead of `return`?
  See https://docs.pytest.org/en/stable/how-to/assert.html#return-not-none for more information.
    warnings.warn(

tests/test_intelligent_simple.py::test_ast_analyzer
  /opt/homebrew/opt/pyenv/versions/3.10.14/lib/python3.10/site-packages/_pytest/python.py:161: PytestReturnNotNoneWarning: Test functions should return None, but tests/test_intelligent_simple.py::test_ast_analyzer returned <class 'bool'>.
  Did you mean to use `assert` instead of `return`?
  See https://docs.pytest.org/en/stable/how-to/assert.html#return-not-none for more information.
    warnings.warn(

tests/test_intelligent_system.py::test_intelligent_analyzer
  /opt/homebrew/opt/pyenv/versions/3.10.14/lib/python3.10/site-packages/_pytest/python.py:161: PytestReturnNotNoneWarning: Test functions should return None, but tests/test_intelligent_system.py::test_intelligent_analyzer returned <class 'bool'>.
  Did you mean to use `assert` instead of `return`?
  See https://docs.pytest.org/en/stable/how-to/assert.html#return-not-none for more information.
    warnings.warn(

tests/test_intelligent_system.py::test_intelligent_memory
  /opt/homebrew/opt/pyenv/versions/3.10.14/lib/python3.10/site-packages/_pytest/python.py:161: PytestReturnNotNoneWarning: Test functions should return None, but tests/test_intelligent_system.py::test_intelligent_memory returned <class 'bool'>.
  Did you mean to use `assert` instead of `return`?
  See https://docs.pytest.org/en/stable/how-to/assert.html#return-not-none for more information.
    warnings.warn(

tests/test_intelligent_system.py::test_intelligent_orchestrator
  /opt/homebrew/opt/pyenv/versions/3.10.14/lib/python3.10/site-packages/_pytest/python.py:161: PytestReturnNotNoneWarning: Test functions should return None, but tests/test_intelligent_system.py::test_intelligent_orchestrator returned <class 'bool'>.
  Did you mean to use `assert` instead of `return`?
  See https://docs.pytest.org/en/stable/how-to/assert.html#return-not-none for more information.
    warnings.warn(

tests/test_intelligent_system.py::test_integration
  /opt/homebrew/opt/pyenv/versions/3.10.14/lib/python3.10/site-packages/_pytest/python.py:161: PytestReturnNotNoneWarning: Test functions should return None, but tests/test_intelligent_system.py::test_integration returned <class 'bool'>.
  Did you mean to use `assert` instead of `return`?
  See https://docs.pytest.org/en/stable/how-to/assert.html#return-not-none for more information.
    warnings.warn(

tests/test_intelligent_system_simple.py::test_simple_analysis
  /opt/homebrew/opt/pyenv/versions/3.10.14/lib/python3.10/site-packages/_pytest/python.py:161: PytestReturnNotNoneWarning: Test functions should return None, but tests/test_intelligent_system_simple.py::test_simple_analysis returned <class 'bool'>.
  Did you mean to use `assert` instead of `return`?
  See https://docs.pytest.org/en/stable/how-to/assert.html#return-not-none for more information.
    warnings.warn(

tests/test_plugin_complet.py::test_vscode_installation
  /opt/homebrew/opt/pyenv/versions/3.10.14/lib/python3.10/site-packages/_pytest/python.py:161: PytestReturnNotNoneWarning: Test functions should return None, but tests/test_plugin_complet.py::test_vscode_installation returned <class 'bool'>.
  Did you mean to use `assert` instead of `return`?
  See https://docs.pytest.org/en/stable/how-to/assert.html#return-not-none for more information.
    warnings.warn(

tests/test_plugin_complet.py::test_plugin_compilation
  /opt/homebrew/opt/pyenv/versions/3.10.14/lib/python3.10/site-packages/_pytest/python.py:161: PytestReturnNotNoneWarning: Test functions should return None, but tests/test_plugin_complet.py::test_plugin_compilation returned <class 'bool'>.
  Did you mean to use `assert` instead of `return`?
  See https://docs.pytest.org/en/stable/how-to/assert.html#return-not-none for more information.
    warnings.warn(

tests/test_plugin_complet.py::test_package_json
  /opt/homebrew/opt/pyenv/versions/3.10.14/lib/python3.10/site-packages/_pytest/python.py:161: PytestReturnNotNoneWarning: Test functions should return None, but tests/test_plugin_complet.py::test_package_json returned <class 'bool'>.
  Did you mean to use `assert` instead of `return`?
  See https://docs.pytest.org/en/stable/how-to/assert.html#return-not-none for more information.
    warnings.warn(

tests/test_plugin_complet.py::test_ai_server
  /opt/homebrew/opt/pyenv/versions/3.10.14/lib/python3.10/site-packages/_pytest/python.py:161: PytestReturnNotNoneWarning: Test functions should return None, but tests/test_plugin_complet.py::test_ai_server returned <class 'bool'>.
  Did you mean to use `assert` instead of `return`?
  See https://docs.pytest.org/en/stable/how-to/assert.html#return-not-none for more information.
    warnings.warn(

tests/test_plugin_complet.py::test_apple_double_files
  /opt/homebrew/opt/pyenv/versions/3.10.14/lib/python3.10/site-packages/_pytest/python.py:161: PytestReturnNotNoneWarning: Test functions should return None, but tests/test_plugin_complet.py::test_apple_double_files returned <class 'bool'>.
  Did you mean to use `assert` instead of `return`?
  See https://docs.pytest.org/en/stable/how-to/assert.html#return-not-none for more information.
    warnings.warn(

-- Docs: https://docs.pytest.org/en/stable/how-to/capture-warnings.html

----------------------------------------------------------------------------------------------------------------------- benchmark 'critical_functions': 2 tests -----------------------------------------------------------------------------------------------------------------------
Name (time in ns)                                                                                   Min                     Max                  Mean                StdDev                Median                   IQR            Outliers  OPS (Kops/s)            Rounds  Iterations
---------------------------------------------------------------------------------------------------------------------------------------------------------------------------------------------------------------------------------------------------------------------------------------
test_critical_function_benchmark[athalia_core.auto_tester-AutoTester-False]                    883.4060 (1.0)       35,433.1918 (1.0)      1,005.0332 (1.0)        384.5787 (1.0)        966.5964 (1.0)         25.0060 (1.0)    3263;13449      994.9920 (1.0)      198373           5
test_critical_function_benchmark[athalia_core.advanced_analytics-AdvancedAnalytics-True]     7,790.9790 (8.82)     134,083.9081 (3.78)     9,390.2465 (9.34)     3,655.0012 (9.50)     8,500.0647 (8.79)     1,417.0073 (56.67)     369;565      106.4935 (0.11)      12821           1
---------------------------------------------------------------------------------------------------------------------------------------------------------------------------------------------------------------------------------------------------------------------------------------

Legend:
  Outliers: 1 Standard Deviation from Mean; 1.5 IQR (InterQuartile Range) from 1st Quartile and 3rd Quartile.
  OPS: Operations Per Second, computed as 1 / Mean
=========================== short test summary info ============================
FAILED tests/integration/test_cli_robustesse.py::test_cli_robustesse - subpro...
FAILED tests/test_benchmark_critical.py::test_critical_function_benchmark[athalia_core.athalia_orchestrator-AthaliaOrchestrator-False]
FAILED tests/test_ci_basic.py::TestCIBasic::test_github_workflow_structure - ...
FAILED tests/test_correction_optimizer_optimized.py::TestCorrectionOptimizerOptimized::test_basic_corrections
FAILED tests/test_correction_optimizer_optimized.py::TestCorrectionOptimizerOptimized::test_complex_correction
FAILED tests/test_correction_optimizer_optimized.py::TestCorrectionOptimizerOptimized::test_contextual_corrections
FAILED tests/test_correction_optimizer_optimized.py::TestCorrectionOptimizerOptimized::test_convenience_functions
FAILED tests/test_correction_optimizer_optimized.py::TestCorrectionOptimizerOptimized::test_error_handling
FAILED tests/test_correction_optimizer_optimized.py::TestCorrectionOptimizerIntegration::test_with_real_files
FAILED tests/test_intelligent_simple.py::test_pattern_detector - FileNotFound...
FAILED tests/test_intelligent_simple.py::test_architecture_analyzer - FileNot...
FAILED tests/test_intelligent_simple.py::test_performance_analyzer - FileNotF...
FAILED tests/test_no_polluting_files.py::TestNoPollutingFiles::test_no_archive_files
FAILED tests/test_no_polluting_files.py::TestNoPollutingFiles::test_no_large_files
FAILED tests/test_phase2_integration.py::TestPhase2Documentation::test_templates_documentation_exists
FAILED tests/test_phase2_integration.py::TestPhase2Documentation::test_phase2_implementation_documentation_exists
FAILED tests/test_security_patterns.py::TestSecurityPatterns::test_no_shell_injection
===== 17 failed, 314 passed, 101 skipped, 60 warnings in 356.27s (0:05:56) =====
